{
  "$schema": "https://json-schema.org/draft/2020-12/schema",
  "type": "array",
  "minItems": 10,
  "items": {
    "type": "object",
    "additionalProperties": false,
    "required": ["id", "name", "tier", "price", "maxDurability", "tags", "flavor"],
    "properties": {
      "id": { "type": "string", "minLength": 2 },
      "name": { "type": "string", "minLength": 2 },
      "tier": { "type": "integer", "minimum": 1, "maximum": 5 },
      "price": { "type": "integer", "minimum": 1 },
      "maxDurability": { "type": "integer", "minimum": 1 },
      "tags": {
        "type": "array",
        "minItems": 1,
        "items": { "type": "string", "minLength": 2 }
      },
      "flavor": {
        "type": "object",
        "additionalProperties": false,
        "required": ["description", "quip_buy", "quip_break"],
        "properties": {
          "description": { "type": "string", "minLength": 2 },
          "quip_buy": { "type": "string", "minLength": 2 },
          "quip_break": { "type": "string", "minLength": 2 }
        }
      }
    }
  }
}